comment_id,post_id,subreddit,camp,author,parent_id,parent_author,body,score,created_utc,depth,post_author,text_clean,tokens,tokens_str,word_count,unique_words,lexical_diversity,sci_keyword_count,denial_keyword_count,keyword_alignment,log_score
Ugwf6h-vJZ9c9vCtiT94AaABAg,Q7yvvq-9ytE,youtube_science,science,@jubilee,video_Q7yvvq-9ytE,Jubilee,"We started a podcast! Listen to a follow-up conversation with one of the Flat Earthers in this first episode: 👉https://anchor.fm/radicalempathy 👈 - leave us a voice message after listening!

After many requests, we're happy to share this episode of Middle Ground with you all! In this episode, we explore belief, science, and how our experiences shape our worldview. We'd love to hear your thoughts!",19706,2019-10-11T19:21:28Z,0,Jubilee,we started a podcast listen to a follow up conversation with one of the flat earthers in this first episode leave us a voice message after listening after many requests we're happy to share this episode of middle ground with you all in this episode we explore belief science and how our experiences shape our worldview we'd love to hear your thoughts,"['start', 'podcast', 'listen', 'follow', 'conversation', 'flat', 'earther', 'first', 'episode', 'leave', 'voice', 'message', 'listen', 'many', 'request', ""we're"", 'happy', 'share', 'episode', 'middle', 'ground', 'episode', 'explore', 'belief', 'science', 'experienc', 'shape', 'worldview', ""we'd"", 'love', 'hear', 'thought']",start podcast listen follow conversation flat earther first episode leave voice message listen many request we're happy share episode middle ground episode explore belief science experienc shape worldview we'd love hear thought,32,29,0.90625,0,0,neutral,9.888729181560583
Ugwf6h-vJZ9c9vCtiT94AaABAg.9-xphgBQMI_9-xpxD8pyxY,Q7yvvq-9ytE,youtube_science,science,@everythingisawesome2903,comment_@jubilee,@jubilee,"I used to think this whole ""flat earth"" thing is just one of those Internet jokes where trolls are pretending that earth is flat, you would think this joke is only staying on Internet. Until I came to know that there are people out there who actually believe that earth is flat and conduct conferences for it from time to time. What's worse is these people even bring their children into these places and brainwashing their mind since childhood.",1181,2019-10-11T19:23:35Z,1,Jubilee,i used to think this whole flat earth thing is just one of those internet jokes where trolls are pretending that earth is flat you would think this joke is only staying on internet until i came to know that there are people out there who actually believe that earth is flat and conduct conferences for it from time to time what's worse is these people even bring their children into these places and brainwashing their mind since childhood,"['used', 'whole', 'flat', 'earth', 'internet', 'jok', 'troll', 'pretend', 'earth', 'flat', 'joke', 'stay', 'internet', 'came', 'know', 'actual', 'believe', 'earth', 'flat', 'conduct', 'conferenc', 'time', 'time', ""what'"", 'worse', 'bring', 'children', 'plac', 'brainwash', 'mind', 'since', 'childhood']",used whole flat earth internet jok troll pretend earth flat joke stay internet came know actual believe earth flat conduct conferenc time time what' worse bring children plac brainwash mind since childhood,32,26,0.8125,0,0,neutral,7.074963197966044
Ugwf6h-vJZ9c9vCtiT94AaABAg.9-xphgBQMI_9-xr3XLC6Ye,Q7yvvq-9ytE,youtube_science,science,@TheOne10525,comment_@jubilee,@jubilee,"Can we have the name of the participants, specially the scientists!!!",125,2019-10-11T19:33:20Z,1,Jubilee,can we have the name of the participants specially the scientists,"['name', 'participant', 'special', 'scientist']",name participant special scientist,4,4,1.0,1,0,science,4.836281906951478
UgxCiL7zOPwoK-veaMR4AaABAg,Q7yvvq-9ytE,youtube_science,science,@amazinghannure6440,video_Q7yvvq-9ytE,Jubilee,"It's hard to win an argument against a smart person, but it's impossible to win an argument against an ignorant person",160367,2019-10-12T17:14:07Z,0,Jubilee,it's hard to win an argument against a smart person but it's impossible to win an argument against an ignorant person,"[""it's"", 'hard', 'win', 'argument', 'smart', 'person', ""it's"", 'impossible', 'win', 'argument', 'ignorant', 'person']",it's hard win argument smart person it's impossible win argument ignorant person,12,8,0.6666666666666666,0,0,neutral,11.985226453264648
UgxCiL7zOPwoK-veaMR4AaABAg.90-AvmLDhEC90-BtdowDGm,Q7yvvq-9ytE,youtube_science,science,@adealtas,comment_@amazinghannure6440,@amazinghannure6440,Hell N Degenerates and you're the perfect example that could describe that quote,6704,2019-10-12T17:22:34Z,1,Jubilee,hell n degenerates and you're the perfect example that could describe that quote,"['hell', 'degenerat', ""you're"", 'perfect', 'example', 'describe', 'quote']",hell degenerat you're perfect example describe quote,7,7,1.0,0,0,neutral,8.81060879571578
UgxCiL7zOPwoK-veaMR4AaABAg.90-AvmLDhEC90-Dk2Yxrpa,Q7yvvq-9ytE,youtube_science,science,@theunknownonetuo2033,comment_@amazinghannure6440,@amazinghannure6440,"@adealtas Deymmmm chill out man, that's too harsh😂",1357,2019-10-12T17:38:44Z,1,Jubilee,adealtas deymmmm chill out man that's too harsh,"['adealta', 'deymmmm', 'chill', 'man', ""that'"", 'harsh']",adealta deymmmm chill man that' harsh,6,6,1.0,0,0,neutral,7.213768308118642
UgxCiL7zOPwoK-veaMR4AaABAg.90-AvmLDhEC90-FfCpq0T1,Q7yvvq-9ytE,youtube_science,science,@laurenmartin6259,comment_@amazinghannure6440,@amazinghannure6440,"Hell N Degenerates explain how seasons work under a flat theory for me. Like they said, give me some evidence of situations that would NOT occur under the globe earth theory.",2108,2019-10-12T17:55:33Z,1,Jubilee,hell n degenerates explain how seasons work under a flat theory for me like they said give me some evidence of situations that would not occur under the globe earth theory,"['hell', 'degenerat', 'explain', 'season', 'work', 'flat', 'theory', 'said', 'give', 'evidence', 'situation', 'occur', 'globe', 'earth', 'theory']",hell degenerat explain season work flat theory said give evidence situation occur globe earth theory,15,14,0.9333333333333332,1,0,science,7.653969180478774
UgxCiL7zOPwoK-veaMR4AaABAg.90-AvmLDhEC90-GTAtuf6B,Q7yvvq-9ytE,youtube_science,science,@hereliesmyreputation2559,comment_@amazinghannure6440,@amazinghannure6440,"@laurenmartin6259 Perfect. How would anything work with a flat Earth. Seasons, days and the zones.",1873,2019-10-12T18:02:30Z,1,Jubilee,laurenmartin perfect how would anything work with a flat earth seasons days and the zones,"['laurenmartin', 'perfect', 'anyth', 'work', 'flat', 'earth', 'season', 'days', 'zon']",laurenmartin perfect anyth work flat earth season days zon,9,9,1.0,0,0,neutral,7.535830462798367
Ugzx-OARVV9zCQmOJ_p4AaABAg,Q7yvvq-9ytE,youtube_science,science,@Skibidi_Dih,video_Q7yvvq-9ytE,Jubilee,It’s genuinely beautiful how everyone with different ideologies and political opinions can harmonize so quickly and unite against flat-earthers 😭,2769,2025-12-04T02:10:56Z,0,Jubilee,it s genuinely beautiful how everyone with different ideologies and political opinions can harmonize so quickly and unite against flat earthers,"['genuine', 'beautiful', 'everyone', 'different', 'ideolog', 'political', 'opinion', 'harmonize', 'quick', 'unite', 'flat', 'earther']",genuine beautiful everyone different ideolog political opinion harmonize quick unite flat earther,12,12,1.0,0,0,neutral,7.926602599181384
Ugzx-OARVV9zCQmOJ_p4AaABAg.AQIGA-ZPCI1ASTTsso9KSr,Q7yvvq-9ytE,youtube_science,science,@OktamjonAhroridinov,comment_@Skibidi_Dih,@Skibidi_Dih,"Wow, thank you. Now I should re-watch the whole thing from a fresh angle 😂",2,2026-01-27T03:45:14Z,1,Jubilee,wow thank you now i should re watch the whole thing from a fresh angle,"['wow', 'thank', 'watch', 'whole', 'fresh', 'angle']",wow thank watch whole fresh angle,6,6,1.0,0,0,neutral,1.0986122886681098
Ugzx-OARVV9zCQmOJ_p4AaABAg.AQIGA-ZPCI1AT9gxoK3Y4b,Q7yvvq-9ytE,youtube_science,science,@buddybid123,comment_@Skibidi_Dih,@Skibidi_Dih,"""seperated by nations, united by thoughts"" ahh",75,2026-02-13T07:54:49Z,1,Jubilee,seperated by nations united by thoughts ahh,"['seperat', 'nation', 'unit', 'thought', 'ahh']",seperat nation unit thought ahh,5,5,1.0,0,0,neutral,4.330733340286331
UgzFFnEesFFBQq0Dr0l4AaABAg,Q7yvvq-9ytE,youtube_science,science,@MubarakMarafa,video_Q7yvvq-9ytE,Jubilee,"Scientists: “I’m open to having a...”

Flat Earther: “I’d like to tear them to pieces”",10262,2019-10-15T01:04:48Z,0,Jubilee,scientists i m open to having a flat earther i d like to tear them to pieces,"['scientist', 'open', 'hav', 'flat', 'earther', 'tear', 'piec']",scientist open hav flat earther tear piec,7,7,1.0,1,0,science,9.236300473645716
UgzFFnEesFFBQq0Dr0l4AaABAg.905ANsa9EoT905SpAEfnuw,Q7yvvq-9ytE,youtube_science,science,@swapnilkuwalekar4678,comment_@MubarakMarafa,@MubarakMarafa,excuse me?? its Dan the WATER MANN,246,2019-10-15T03:45:56Z,1,Jubilee,excuse me its dan the water mann,"['excuse', 'dan', 'water', 'mann']",excuse dan water mann,4,4,1.0,0,0,neutral,5.5093883366279774
UgzFFnEesFFBQq0Dr0l4AaABAg.905ANsa9EoT9UYkUPv4dL9,Q7yvvq-9ytE,youtube_science,science,@88feji,comment_@MubarakMarafa,@MubarakMarafa,By the look in his eyes he really wants to tear them to pieces ... physically ...,36,2021-11-10T04:28:48Z,1,Jubilee,by the look in his eyes he really wants to tear them to pieces physically,"['look', 'eyes', 'want', 'tear', 'piec', 'physical']",look eyes want tear piec physical,6,6,1.0,0,0,neutral,3.610917912644224
UgzFFnEesFFBQq0Dr0l4AaABAg.905ANsa9EoT9UcUuYFB4C8,Q7yvvq-9ytE,youtube_science,science,@ccatlc,comment_@MubarakMarafa,@MubarakMarafa,How he felt after saying that 🐶👺,135,2021-11-12T00:40:09Z,1,Jubilee,how he felt after saying that,"['felt', 'say']",felt say,2,2,1.0,0,0,neutral,4.912654885736052
Ugwe3OyB7rsv5bA1jmh4AaABAg,Q7yvvq-9ytE,youtube_science,science,@HarrisonRyon,video_Q7yvvq-9ytE,Jubilee,"""My name is Wendall and I am a logical, biblically-based, scientific flat earther.""
How do you contradict yourself so hard in one sentence.",1598,2026-04-14T01:40:50Z,0,Jubilee,my name is wendall and i am a logical biblically based scientific flat earther how do you contradict yourself so hard in one sentence,"['name', 'wendall', 'logical', 'biblical', 'bas', 'scientific', 'flat', 'earther', 'contradict', 'yourself', 'hard', 'sentence']",name wendall logical biblical bas scientific flat earther contradict yourself hard sentence,12,12,1.0,0,0,neutral,7.377133712833954
Ugwe3OyB7rsv5bA1jmh4AaABAg.AVZWr9hHsyLAVb47S1_igv,Q7yvvq-9ytE,youtube_science,science,@hujingtao837,comment_@HarrisonRyon,@HarrisonRyon,"​@pavar21 To be fair, Newton is a Christian too",21,2026-04-15T01:27:30Z,1,Jubilee,pavar to be fair newton is a christian too,"['pavar', 'fair', 'newton', 'christian']",pavar fair newton christian,4,4,1.0,0,0,neutral,3.091042453358316
Ugwe3OyB7rsv5bA1jmh4AaABAg.AVZWr9hHsyLAVdHpD-CcqV,Q7yvvq-9ytE,youtube_science,science,@Velo1010,comment_@HarrisonRyon,@HarrisonRyon,The Bible isn’t taken literally. It’s a big collection of books that teach lessons.,2,2026-04-15T22:05:42Z,1,Jubilee,the bible isn t taken literally it s a big collection of books that teach lessons,"['bible', 'isn', 'taken', 'literal', 'big', 'collection', 'book', 'teach', 'lesson']",bible isn taken literal big collection book teach lesson,9,9,1.0,0,0,neutral,1.0986122886681098
Ugwe3OyB7rsv5bA1jmh4AaABAg.AVZWr9hHsyLAVdLWgvibOk,Q7yvvq-9ytE,youtube_science,science,@just_an_alt_to_report_stuff,comment_@HarrisonRyon,@HarrisonRyon,"@Velo1010  Some parts can be taken literally (Christ), some parts not (most early Genesis, Revelation). Flat Earth is not even biblically supported because the genealogies can be metaphorical and Genesis 8:9 contradicts 4-5 if taken literally (as flat earth does). I literally can't even find a flat earth model that works for basic reality (show me correct day/night times and seasons that don't violate every property of photons we know of).",9,2026-04-15T22:37:59Z,1,Jubilee,velo some parts can be taken literally christ some parts not most early genesis revelation flat earth is not even biblically supported because the genealogies can be metaphorical and genesis contradicts if taken literally as flat earth does i literally can't even find a flat earth model that works for basic reality show me correct day night times and seasons that don't violate every property of photons we know of,"['velo', 'part', 'taken', 'literal', 'christ', 'part', 'ear', 'genesi', 'revelation', 'flat', 'earth', 'biblical', 'support', 'genealog', 'metaphorical', 'genesi', 'contradict', 'taken', 'literal', 'flat', 'earth', 'literal', ""can't"", 'find', 'flat', 'earth', 'model', 'work', 'basic', 'reality', 'show', 'correct', 'day', 'night', 'tim', 'season', ""don't"", 'violate', 'every', 'property', 'photon', 'know']",velo part taken literal christ part ear genesi revelation flat earth biblical support genealog metaphorical genesi contradict taken literal flat earth literal can't find flat earth model work basic reality show correct day night tim season don't violate every property photon know,42,33,0.7857142857142857,1,0,science,2.302585092994046
Ugwe3OyB7rsv5bA1jmh4AaABAg.AVZWr9hHsyLAVfhTQ9RPqQ,Q7yvvq-9ytE,youtube_science,science,@Sneha-y9n1w,comment_@HarrisonRyon,@HarrisonRyon,​@hujingtao837yes but scientist don't follow Bible...,7,2026-04-16T20:37:00Z,1,Jubilee,hujingtao yes but scientist don't follow bible,"['hujingtao', 'yes', 'scientist', ""don't"", 'follow', 'bible']",hujingtao yes scientist don't follow bible,6,6,1.0,1,0,science,2.079441541679836
